Website Feature, App Feature
Homepage, User Onboarding
Navigation Menu, Dashboard
Search Functionality, In-App Navigation
Contact Information, Push Notifications
About Us Page, Settings and Preferences
Product/Service Pages, User Profiles
Blog/News Section, Messaging and Communication
User Authentication, Geolocation Services
Social Media Integration, Offline Functionality
Feedback and Review System, In-App Purchases
FAQ Section, Gamification Elements
E-commerce Features, Analytics and Reporting
Responsive Design, Authentication and Security
Newsletter Subscription, Social Media Integration
Live Chat Support, Augmented Reality (AR) Features
Video Content, Virtual Reality (VR) Features
Image Gallery, Barcode/QR Code Scanner
Events Calendar, Photo/Video Capture
Downloadable Resources, Document Scanner
Multi-language Support, Voice Recognition
User Forums, Biometric Authentication
Job Opportunities, Wearable Device Integration
Customer Testimonials, Smartwatch Compatibility
Interactive Maps, Health and Fitness Tracking
User Ratings, Calendar Integration
Mobile App Integration, File Sharing
Podcasts, Cloud Storage Integration
RSS Feeds, Calendar and Event Management
User Surveys, To-Do Lists
Polls, Reminder Notifications
Chatbots, Notes and Journaling
Member Profiles, Language Translation
Virtual Tours, Expense Tracking
Webinars, Budgeting Tools
Accessibility Features, Navigation and Maps
Dark Mode, Ride-Sharing Integration
API Integration, Food Delivery Integration
Search Engine Optimization (SEO), Review and Ratings
User Notifications, Travel Itineraries
360-Degree Views, Offline Maps
Augmented Reality (AR) Features, Music and Audio Playback
Secure Payment Gateways, Podcast Integration
Real-time Analytics, Video Streaming
Social Sharing Buttons, Live Streaming
Personalized Recommendations, E-learning and Courses
Progressive Web App (PWA) Features, Meditation and Relaxation Features
Online Booking System, Task Automation
Customer Support Ticketing System, Home Automation (IoT) Integration
User-generated Content, Social Networking Features
Newsletters Archive, Dating Features
Featured Content Sections, Job Search and Recruitment
Integrated Learning Resources, News Feed
Browser Push Notifications, Weather Updates
Sticky Navigation, Augmented Reality Filters
Sticky Footer, Shopping Cart
Parallax Scrolling, Order Tracking
Mega Menus, Loyalty Programs
Sitemap, Barcode/QR Code Payment
GDPR Compliance, Cryptocurrency Wallet
Terms of Service, Donation Integration
Privacy Policy, AR Shopping Try-On
cookie consent banner, Language Learning Tools
, AR Measurement Tools
, Emergency Services Integration
, Public Transportation Information
, Parking Spot Finder
, Augmented Reality Games
, Multiplayer Gaming
, Virtual Pet Features
, QR Code-based Loyalty Programs
, Language Translation in Camera
, Emergency SOS Features
, Video Editing Tools
, AR Navigation for Indoor Spaces
, Video Conferencing
, Video Editing and Filters
, 360-Degree Photo/Video Viewing
, Language Exchange Features
, Personal Finance Management
, Digital Wallet
, AR Home Design and Decor
, Real-time Language Translation in Calls
, Carpooling Features
, Remote Control for Smart Devices
, Emergency Health Features
, Mood Tracking and Journaling
, Customizable Widgets
, Habit Tracking
, Group Planning and Event Coordination
, AR Navigation for Outdoor Activities
, AI-Powered Personal Assistant
